{
  "schema": "cordis.step-result.v1",
  "task_id": "task-conformance-1",
  "plan_id": "plan-conformance-1",
  "plan_version": 1,
  "step_id": "S1",
  "status": "success",
  "actions": [
    "Ran cargo test --workspace"
  ],
  "observations": [
    "All workspace tests passed"
  ],
  "artifacts": [
    "artifact://cargo-test.log"
  ],
  "evidence": [
    {
      "id": "ev-workspace-test",
      "kind": "test",
      "summary": "cargo test --workspace passed",
      "passed": true,
      "uri": "artifact://cargo-test.log",
      "acceptance_id": "workspace-tests",
      "source_id": "ci-run-1",
      "trust": "observed"
    }
  ],
  "errors": [],
  "proposed_next": null
}
